,username,date,tweet,language,hashtags
898,borisjohnson,2020-05-13,"We will come back from this. And though the United Kingdom will be changed by this experience, I believe we can be stronger and better than ever before. #StayAlert  https://t.co/NOg7xlHfyL",en,['stayalert']
895,borisjohnson,2020-05-14,"There could be no greater mistake than to jeopardise everything we have striven to achieve by proceeding too far and too fast.   We must all continue to #StayAlert, so that we can control the virus and save lives.",en,['stayalert']
894,borisjohnson,2020-05-14,Thank you for all that you have been doing so far.   Let’s keep going.  https://t.co/IrEkFgVAQy,en,[]
892,borisjohnson,2020-05-14,"Thank you to those wonderful people who care for all of us when we need it the most. Tonight, we clapped for all of you.   #ThankYouNHS #ClapForCarers  https://t.co/ogD2vG4JUX",en,"['thankyounhs', 'clapforcarers']"
893,borisjohnson,2020-05-14,We all have a role to play in containing the virus.   Read the latest government advice here:  https://t.co/9wx7FJCjWC  #StayAlert  https://t.co/UmgLOn0G3l,en,['stayalert']
891,borisjohnson,2020-05-15,We can beat this virus together - but only if we all continue to #StayAlert and follow the rules on social distancing.  https://t.co/QM3Wx5b1B6,en,['stayalert']
890,borisjohnson,2020-05-15,"Like the front windows of houses across the nation, our window at Downing Street is filled with rainbows drawn by children in support of the NHS.   Thank you to all the families who have sent in their drawings to be displayed. They are a symbol of hope for us all. #ThankYouNHS  https://t.co/2uFL7IghGU",en,['thankyounhs']
889,borisjohnson,2020-05-16,"This weekend, we must all continue to stay alert and control the virus.  #StayAlert  https://t.co/UQJ9QbHWrJ",en,['stayalert']
888,borisjohnson,2020-05-16,We all have a role to play in containing the virus.   Read the latest government advice here:  https://t.co/9wx7FJCjWC  #StayAlert  https://t.co/LAIKLmMGkL,en,['stayalert']
887,borisjohnson,2020-05-17,"I know this will not be easy — the first baby steps never are. But I hope that, when we look back, the changes we have made this week will be seen as an important moment on the road to our nation’s recovery.   https://t.co/hEdg4k2333",en,[]
886,borisjohnson,2020-05-17,We can beat this virus together – but only if we stay alert.  https://t.co/KR4TEO96fN,en,[]
885,borisjohnson,2020-05-18,"These are difficult times for all. Talking to others about how we are feeling and reaching out to those in need has never been more important.   If you are struggling, or are worried about someone, reach out for help:  https://t.co/tHBIQW32xB  #MentalHealthAwarenessWeek",en,['mentalhealthawarenessweek']
884,borisjohnson,2020-05-18,Thank you for all that you are doing.  Please #StayAlert and continue to follow the government guidelines:  https://t.co/Eew4i0Wr5q  https://t.co/sSqbEgyVEf,en,['stayalert']
883,borisjohnson,2020-05-18,The common sense of the British people got us through that first phase of this disease. I am absolutely confident it will get us through the next as well. #StayAlert,en,['stayalert']
882,borisjohnson,2020-05-19,Thank you for all you are doing to fight this virus.   Let’s keep going.  #StayAlert  https://t.co/hkLCodZzc8,en,['stayalert']
881,borisjohnson,2020-05-19,"I know this has been a tough time for so many people. Thank you for all of the sacrifices you have made.   We are past the peak, and I’m confident that if we continue to follow the rules and work together, we will beat this virus and be reunited with our friends and family soon.",en,[]
880,borisjohnson,2020-05-20,".@captaintommoore you have inspired us all with your fantastic fundraising efforts.   On behalf of the whole country, I want to say a huge thank you.     https://t.co/KQ6OBGuqk0",en,[]
876,borisjohnson,2020-05-21,Thank you to all of our wonderful carers for your work during the coronavirus pandemic. You make us all proud to have such a fantastic NHS.  https://t.co/owZyGHUvtT,en,[]
879,borisjohnson,2020-05-21,"We are making vast progress in testing and tracing, and I have great confidence that we will have a system very soon that will help us defeat this disease.  https://t.co/BnrDGWA1hg",en,[]
878,borisjohnson,2020-05-21,"We must all continue to #StayAlert, and follow the rules on social distancing.  https://t.co/QKJ5r2da6Q",en,['stayalert']
877,borisjohnson,2020-05-21,Today I hosted a summit to explore how we can ensure that all children and adults are protected and supported during this challenging time.   It is vital that we come together and bring all our collective expertise to ensure we do everything we can to support those at risk.  https://t.co/QujgDNtlC6,en,[]
871,borisjohnson,2020-05-22,"If you have symptoms of #coronavirus, you should self-isolate and get yourself tested.   Symptoms include:  ⚫ a high temperature  ⚫ a new continuous cough  ⚫ change or loss of smell or taste   To book a test visit:  https://t.co/LVuGupz3Pk  https://t.co/a07bsZlyu0",en,['coronavirus']
872,borisjohnson,2020-05-22,"Seven years on from his murder on a London street, we remember Fusilier Lee Rigby. On this sad day, my thoughts are with his family, friends and colleagues.",en,[]
875,borisjohnson,2020-05-22,"Yesterday I hosted the Hidden Harms Summit at 10 Downing Street, to discuss how we can tackle crimes like domestic abuse and modern slavery.  https://t.co/h2lsk3FWhW",en,[]
874,borisjohnson,2020-05-22,"Today, on the third anniversary of the Manchester Arena attack, we remember the 22 lives which were so cruelly taken. My thoughts are with all of those grieving for the loss of their loved ones.",en,[]
873,borisjohnson,2020-05-22,"It’s so important we all continue to stay alert and follow the rules.   Keep 2 metres from others. Wash your hands regularly.   Self-isolate immediately if you develop a new continuous cough, a high temperature or a change or loss of your sense of taste or smell.  #StayAlert  https://t.co/dbDeA0EXNH",en,['stayalert']
870,borisjohnson,2020-05-23,"If you have symptoms of #coronavirus, you should self-isolate and get yourself tested.   To book a test visit:  https://t.co/LVuGupz3Pk  https://t.co/Hngxgl6n7d",en,['coronavirus']
869,borisjohnson,2020-05-25,"In line with the approach being taken by many other countries, we want to start getting our children back into the classroom, in a way that is as safe as possible.  https://t.co/QGKOrLoqsZ",en,[]
868,borisjohnson,2020-05-26,"If you have symptoms of #coronavirus, you are eligible for testing.  To book a test visit:  https://t.co/LVuGupz3Pk  https://t.co/Vzs0DVDCBP",en,['coronavirus']
867,borisjohnson,2020-05-26,"We’re past the peak, but we can’t get complacent.   Stay alert, keep 2 metres away from others and wash your hands regularly.  #StayAlert  https://t.co/F8x3rypVC7",en,['stayalert']
866,borisjohnson,2020-05-27,"We all have a role to play in beating coronavirus.    #StayAlert, control the virus, save lives.  https://t.co/AcG3TKgDj9",en,['stayalert']
865,borisjohnson,2020-05-27,"Together we have made it through the peak, but we’re not yet back to normal.  Please continue to #StayAlert and keep 2 metres away from others when outside.  https://t.co/yR2DpjxtrK",en,['stayalert']
864,borisjohnson,2020-05-28,"If we are to defeat COVID-19, achieve a global recovery and avoid a future pandemic, then we must work together across borders.  https://t.co/Mbp8BhOWJT",en,[]
863,borisjohnson,2020-05-28,"Today’s clap for carers marks 10 weeks of celebrating our wonderful NHS and carers in this way.   I want to thank each and every one of our wonderful NHS and care workers for the incredible, selfless work they do to look after us all.  https://t.co/ED266uH9RK",en,[]
858,borisjohnson,2020-05-29,"From Monday, we will allow up to 6 people to meet outside provided those from different households continue to strictly observe social distancing rules by staying 2 metres apart.   #StayAlert  https://t.co/JBHdpDqLDj",en,['stayalert']
859,borisjohnson,2020-05-29,"But I must stress that to control the virus, everyone needs to stay alert, act responsibly and strictly observe social distancing rules by staying two metres apart from those who you do not live with. (3/3)",en,[]
857,borisjohnson,2020-05-29,"On International Day of UN Peacekeepers, I want to pay my tribute to the Blue Helmets and many others who do so much to bring peace in areas of the world torn apart by conflict.   #PKDay",en,['pkday']
861,borisjohnson,2020-05-29,"From Monday we will allow up to six people to meet outside, provided those from different households continue strictly to observe social distancing rules by staying two metres apart. (1/3)",en,[]
862,borisjohnson,2020-05-29,"Thanks to your resolve and dedication, the five tests are being met and we can now start to ease some restrictions in England.   As places begin to reopen, we must all continue to #StayAlert and keep 2 metres away from others.  https://t.co/Qgnme5V08N",en,['stayalert']
860,borisjohnson,2020-05-29,"These changes mean friends and family can start to meet their loved ones - perhaps seeing both parents at once, or both grandparents at once. I know that for many this will be a long-awaited and joyful moment. (2/3)",en,[]
856,borisjohnson,2020-05-30,"As we begin to ease some restrictions, it’s so important that we continue to stay alert to the risk of infection.   Keep 2 metres away from others and wash your hands regularly.        #StayAlert  https://t.co/Fztuj8Efjm",en,['stayalert']
855,borisjohnson,2020-05-30,"Thanks to our collective national effort, we have protected our NHS and saved many lives.    Let’s continue to fight this virus by staying alert and keeping 2 metres apart. #StayAlert  https://t.co/9EtUNif28x",en,['stayalert']
854,borisjohnson,2020-05-31,"I know many of you will be enjoying the warmer weather today.    If you’re out exercising or meeting a friend, remember to stay 2 metres apart and wash your hands regularly.   #StayAlert  https://t.co/DXMbvX8hFn",en,['stayalert']
851,borisjohnson,2020-06-01,You are eligible for a test if you have #coronavirus symptoms:   🔵 a high temperature  🔵 a new continuous cough  🔵 loss or change to your sense of smell or taste  More information here:  https://t.co/47UIka9nis  https://t.co/OqaSeZwgP4,en,['coronavirus']
850,borisjohnson,2020-06-01,"At the start of #PrideMonth, I want to thank those in the LGBT community and campaigners for their inspirational work, in fighting tirelessly to overcome the prejudices many face.   Your contribution has helped shape a better future for people in the UK and around the world.",en,['pridemonth']
853,borisjohnson,2020-06-01,"From today, in England, you will be allowed to meet up to five friends in public outdoor places or in your garden. This will be a moment of joy and relief for many.   Please remember to keep 2 metres away from those you don’t live with, and wash your hands regularly.",en,[]
852,borisjohnson,2020-06-01,"As we begin to ease some restrictions in England today, it’s important that we all #StayAlert to the risk of coronavirus.    Remember to wash your hands, stay 2 metres apart, and if you have symptoms, self-isolate and get tested.  https://t.co/0N6PNC4wsZ",en,['stayalert']
849,borisjohnson,2020-06-02,"During #VolunteersWeek I want to say a big thank you to all the volunteers across the UK.    Whether you’ve helped a neighbour with their shopping, or delivered supplies to local hospitals, your kindness and compassion has been admired by us all.   Keep going, and thank you.  https://t.co/Yjt7Qt03Wk",en,['volunteersweek']
848,borisjohnson,2020-06-02,"If you have symptoms of #coronavirus, you should self-isolate and get yourself tested.    Symptoms include:  ⚫ a high temperature  ⚫ a new continuous cough  ⚫ change or loss of smell or taste    To book a test visit:  https://t.co/LVuGupz3Pk  https://t.co/2AqVI5RhOC",en,['coronavirus']
847,borisjohnson,2020-06-02,"If you are contacted by NHS Test and Trace, follow their instructions and self-isolate.    This will help to contain the spread of the virus, protect our NHS and move us closer towards a more normal way of life.    #StayAlert  https://t.co/OvAwTN19AA",en,['stayalert']
846,borisjohnson,2020-06-03,"Britain wants nothing more than for Hong Kong to succeed under “one country, two systems”. I hope that China wants the same. Let us work together to make it so.   https://t.co/yEZSNDGREb",en,[]
845,borisjohnson,2020-06-03,"Thank you for all that you are doing to fight this virus.    As we begin to ease some restrictions, it’s important that we #StayAlert to the risk of infection, and stay 2 metres away from others.  https://t.co/qB5YNBR5pd",en,['stayalert']
844,borisjohnson,2020-06-03,"If you are experiencing symptoms of #coronavirus, you should self-isolate and ask for a test.    Home testing kits are available for anyone with symptoms and members of their household.    You can apply for a test here:  https://t.co/47UIka9nis  https://t.co/kmSzSBoTVE",en,['coronavirus']
840,borisjohnson,2020-06-04,"Let’s continue to fight this virus by staying alert, keeping 2 metres away from others, and regularly washing our hands.    #StayAlert  https://t.co/mC0WZXec6B",en,['stayalert']
842,borisjohnson,2020-06-04,We all have a role to play in beating this virus. Thank you for all that you are doing.   #StayAlert  https://t.co/lPhIojTnp4,en,['stayalert']
843,borisjohnson,2020-06-04,"I have no doubt that the British public will continue to show the same resolve in fighting the virus as they have throughout the outbreak.   We will get through this if we stay alert, control the virus, and in doing so save lives.  https://t.co/mdbHd325Np",en,[]
841,borisjohnson,2020-06-04,"Today I call on countries to back @Gavi, the Global Vaccine Alliance.   Let’s fortify this lifesaving alliance and inaugurate a new era of global health co-operation, which I believe is now the most essential shared endeavour of our lifetimes.",en,[]
838,borisjohnson,2020-06-05,"2/2: Together we rise to fulfil the greatest shared endeavour of our lifetimes: the triumph of humanity over disease, now and for the generations that follow.  https://t.co/tnA0hZx4Uq",en,[]
831,borisjohnson,2020-06-05,"Thank you for all you have been doing to fight the spread of this virus, and to protect our NHS.   We can beat this together.  https://t.co/gXdlVGsxyc",en,[]
832,borisjohnson,2020-06-05,"If you are contacted by an NHS contract tracer who tells you that you have been in contact with someone who has tested positive, you must self-isolate for 14 days.   If everyone follows these guidelines, we can control the spread of the virus, protect our NHS and save lives. 2/2",en,[]
833,borisjohnson,2020-06-05,"If you have coronavirus symptoms (a high temperature, a new continuous cough, or a loss or change to sense of taste or smell) you need to self-isolate and get tested.  There is plenty of capacity and anyone with symptoms is eligible. Order a test from  https://t.co/47UIka9nis 1/2",en,[]
839,borisjohnson,2020-06-05,"1/2: It was a privilege to host yesterday’s Global Vaccine Summit, bringing together countries to vaccinate against the world’s deadliest diseases. The Summit has raised an incredible $8.8bn for @Gavi.  https://t.co/9ub6kaviuf",en,[]
835,borisjohnson,2020-06-05,"As we come through this pandemic and begin to rebuild our economies, it’s time to invest in the industries, infrastructure and jobs that will endure any storm – or even another virus – so we bounce back stronger than before. 3/4",en,[]
836,borisjohnson,2020-06-05,This period has undoubtedly increased our gratitude for and appreciation of the green spaces and nature around us – providing us with respite during such difficult times. 2/4,en,[]
837,borisjohnson,2020-06-05,"Whilst we are all rightly focused on beating coronavirus, we cannot lose sight of the need to protect our people and our planet from the devastating threat of climate change and biodiversity loss if nothing is done. 1/4",en,[]
834,borisjohnson,2020-06-05,"We’re reminded on #WorldEnvironmentDay that nobody can do this alone. That’s why we must move towards a greener, cleaner, and more resilient future, and the UK looks forward to working with countries around the world in the run up to @COP26 in Glasgow next year. 4/4  https://t.co/lhQGTURjCh",en,['worldenvironmentday']
830,borisjohnson,2020-06-06,"Today I am thinking of the men who landed on the beaches of Normandy 76 years ago, who fought and died so that we can be free from the evils of fascism.   We will always be grateful for their courage, and we will always remember their sacrifice.  #DDay76 #DDay  https://t.co/a7WgvK6s8j",en,"['dday76', 'dday']"
829,borisjohnson,2020-06-06,"If you are contacted by an NHS contact tracer who tells you that you have been in contact with someone who has tested positive for coronavirus, you must self-isolate for 14 days.  If everyone follows these guidelines, we can control the virus, protect our NHS and save lives.  https://t.co/ipRa91AU2t",en,[]
828,borisjohnson,2020-06-06,"We all need to #StayAlert, act responsibly, and strictly observe social distancing rules.   Do not meet others inside your home. Stay outdoors, keep 2 metres apart, and wash your hands regularly.  https://t.co/Vb0VWPj9jE",en,['stayalert']
827,borisjohnson,2020-06-07,"The virus spreads more easily indoors, so if you are meeting others today, stay outside and keep 2 metres away at all times.  https://t.co/mUSgo595gQ",en,[]
826,borisjohnson,2020-06-07,We all have a part to play in stopping the spread of coronavirus.   Let’s continue to take extra care by keeping 2 metres apart and washing our hands regularly.   #StayAlert  https://t.co/LmeSUZqIyP,en,['stayalert']
825,borisjohnson,2020-06-07,"Together we have made it through the peak, but we’re not yet back to normal.  Please continue to #StayAlert, keep 2 metres away from others and wash your hands regularly.   If you have symptoms of coronavirus, self-isolate and apply for a home testing kit:  https://t.co/47UIkaqYa0  https://t.co/7icCNU99wK",en,['stayalert']
824,borisjohnson,2020-06-07,People have a right to protest peacefully &amp; while observing social distancing but they have no right to attack the police. These demonstrations have been subverted by thuggery - and they are a betrayal of the cause they purport to serve. Those responsible will be held to account.,en,[]
823,borisjohnson,2020-06-08,"Let us work peacefully and lawfully to defeat racism and discrimination wherever we find it, and let us continue to work together as we put Britain back on its feet.  https://t.co/onUqXbcCGB",en,[]
822,borisjohnson,2020-06-09,"I want to say thank you, from the bottom of my heart, to all carers in the UK helping us through this pandemic.    Whether you work as a carer, or are caring for someone at home, your compassion and strength at this time is a beacon of hope for us all.     #CarersWeek",en,['carersweek']
820,borisjohnson,2020-06-10,"Earlier this week I spoke to members of staff at Foxholes Care Home in Hertfordshire, to thank them all for their work throughout the coronavirus pandemic and beyond.   #CarersWeek  https://t.co/vKCr9pYwMO",en,['carersweek']
821,borisjohnson,2020-06-10,"We must all continue to remember those on the frontline battling this disease, and members of society who are vulnerable - and continue to do all we can to stop the spread of coronavirus.    By doing the right thing and following the rules, you are helping to save lives.",en,[]
819,borisjohnson,2020-06-11,"From this weekend, single adult households, including single parents with children under 18, can form a support bubble with one other household.   We are making this intervention so that those who have been living alone for a long time can reconnect with loved ones.  https://t.co/1OlJXGmUJb",en,[]
818,borisjohnson,2020-06-12,The statue of Winston Churchill in Parliament Square is a permanent reminder of his achievement in saving this country – and the whole of Europe – from a fascist and racist tyranny. 1/8,en,[]
817,borisjohnson,2020-06-12,"It is absurd and shameful that this national monument should today be at risk of attack by violent protestors. Yes, he sometimes expressed opinions that were and are unacceptable to us today, but he was a hero, and he fully deserves his memorial. 2/8",en,[]
816,borisjohnson,2020-06-12,We cannot now try to edit or censor our past. We cannot pretend to have a different history. The statues in our cities and towns were put up by previous generations. 3/8,en,[]
815,borisjohnson,2020-06-12,"They had different perspectives, different understandings of right and wrong. But those statues teach us about our past, with all its faults. To tear them down would be to lie about our history, and impoverish the education of generations to come. 4/8",en,[]
814,borisjohnson,2020-06-12,"As for the planned demonstrations, we all understand the legitimate feelings of outrage at what happened in Minnesota and the legitimate desire to protest against discrimination. 5/8",en,[]
813,borisjohnson,2020-06-12,Whatever progress this country has made in fighting racism - and it has been huge - we all recognise that there is much more work to do. 6/8,en,[]
812,borisjohnson,2020-06-12,But it is clear that the protests have been sadly hijacked by extremists intent on violence. The attacks on the police and indiscriminate acts of violence which we have witnessed over the last week are intolerable and they are abhorrent. 7/8,en,[]
811,borisjohnson,2020-06-12,The only responsible course of action is to stay away from these protests. 8/8,en,[]
810,borisjohnson,2020-06-13,Racist thuggery has no place on our streets. Anyone attacking the police will be met with full force of the law. These marches &amp; protests have been subverted by violence and breach current guidelines. Racism has no part in the UK and we must work together to make that a reality.,en,[]
809,borisjohnson,2020-06-14,"While those affected by Grenfell are not able to gather in person, I want you to know that all of us in this country are with you in spirit.   I remain absolutely committed to uncovering the causes of this tragedy, and ensuring it is never repeated.  https://t.co/m2ZwpEZnLB",en,[]
808,borisjohnson,2020-06-14,"Today I visited Westfield shopping centre in east London, to meet some of the people who work there. They've been working very hard to get ready to reopen tomorrow when we're hoping people will return to the shops.  https://t.co/yx7QDKFm08",en,[]
807,borisjohnson,2020-06-14,"I was delighted to meet those working at Westfield shopping centre, Stratford, where I saw adjustments being made to ensure customers can shop safely.   This week, as shops start reopening in England, remember to follow social distancing rules to protect yourself and others.  https://t.co/uAhZm7yxSt",en,[]
804,borisjohnson,2020-06-15,@AmyCallaghanSNP My thoughts are with Amy and her family. I wish her a speedy and full recovery.,en,[]
805,borisjohnson,2020-06-15,"And if you are feeling lonely or struggling with your mental health, please reach out for help:  https://t.co/tHBIQW32xB    #LonelinessAwarenessWeek (2/2)",en,['lonelinessawarenessweek']
806,borisjohnson,2020-06-15,"I know that the lockdown restrictions have been difficult, and that many will be suffering from loneliness and feelings of isolation.   If you know someone who may be alone at this time, give them a call and let them know that you care.  #LonelinessAwarenessWeek (1/2)",en,['lonelinessawarenessweek']
803,borisjohnson,2020-06-17,"There are few countries in the world who share a closer friendship than Australia and the UK.   Now, as an independent trading nation for the first time in decades, we have the opportunity to turn our shared history and friendship into a world-leading free trade agreement. 🇬🇧🇦🇺  https://t.co/PPWESs3aHq",en,[]
802,borisjohnson,2020-06-17,"I’m proud to call the United Kingdom a friend of New Zealand, and am thrilled that we now have the opportunity to strengthen our alliance by negotiating a new free trade agreement. 🇬🇧🇳🇿  https://t.co/OVMilbAq4G",en,[]
801,borisjohnson,2020-06-18,"The four men we are honouring today – Pierre, Edgard, Daniel and Hubert – symbolise the enduring depth and strength of the friendship between the UK and France. They are heroes who defended us and the whole world from fascism.",en,[]
800,borisjohnson,2020-06-18,"Earlier this week, I was delighted to have an insightful conversation with staff at Charing Cross Hospital. Thank you for all your hard work during this pandemic, and for all that you do to save lives and care for others in need.   #ThankYouNHS  https://t.co/XVodDucAzF",en,['thankyounhs']
799,borisjohnson,2020-06-18,Dame Vera Lynn’s charm and magical voice entranced and uplifted our country in some of our darkest hours. Her voice will live on to lift the hearts of generations to come.,en,[]
798,borisjohnson,2020-06-18,"Thank you to all the fantastic NHS staff I spoke to from Charing Cross Hospital, for all you have done throughout the coronavirus pandemic.  https://t.co/VIVLCZB837",en,[]
797,borisjohnson,2020-06-18,"Welcome to Downing Street, President @EmmanuelMacron 🇬🇧🇫🇷  https://t.co/epDbsYlvM4",en,[]
796,borisjohnson,2020-06-18,"Today I hosted @EmmanuelMacron at @10DowningStreet for the 80th anniversary of General Charles de Gaulle’s Appeal of 18 June. We will never forget the sacrifices that were made for our freedom.   Our countries will forever be neighbours and friends, united by our shared values.  https://t.co/UgZS674M7B",en,[]
794,borisjohnson,2020-06-19,Earlier today I went to Bovingdon Academy to see how they are safely getting kids back into school.  Our £1 billion fund is going to help schools catch up and bounce forward when all schools come back in September.  https://t.co/PwdAFgwHgQ,en,[]
