,username,date,tweet,language,hashtags
277,borisjohnson,2021-02-16,"We recognise the impact this pandemic is having on everyone’s wellbeing and we are working with our Youth Mental Health Ambassador @DrAlexGeorge on this important issue.  If you need support, the NHS is here for you:  https://t.co/tHBIQW32xB",en,[]
278,borisjohnson,2021-02-16,Those who serve in our Armed Forces deserve every recognition for their service. It was a very great injustice that this was denied to some members simply because of their sexuality. I hugely welcome the fact we can now address this historic wrong.,en,[]
276,borisjohnson,2021-02-16,Freedom of speech is at the very core of our democracy. It is absolutely right that our great universities – the historic centres of free thinking and ideas – will now have this freedom protected and bolstered with stronger legal protections.    https://t.co/TrfFN47u3a,en,[]
273,borisjohnson,2021-02-18,"Excellent trip to Wales yesterday to see the extraordinary efforts of all those involved in our fight against coronavirus.  NHS staff, volunteers, the military and the police have all been working hard to get people through the pandemic.  https://t.co/R1Nl33X5PG",en,[]
272,borisjohnson,2021-02-19,"The vaccine protects you, your loved ones and helps us all defeat the virus.  When you are invited to get the jab, please come forward.  #TakeTheVaccine",en,['takethevaccine']
271,borisjohnson,2021-02-19,"The G7 is the great gathering of like-minded, liberal, free-trading democracies. We stand together on many issues around the world.   I look forward to working closely together ahead of the @G7 summit in Cornwall in June.  https://t.co/cQMR5zLxmu",en,[]
270,borisjohnson,2021-02-21,"More than 17.5 million people have now had their first dose; that's more than 1 in 3 adults in the UK.   I want to see the rollout go further and faster in the coming weeks, so we are now aiming to offer a jab to every adult by the end of July.",en,[]
268,borisjohnson,2021-02-22,"Our decisions will be made on the latest data at every step, and we will be cautious about this approach so that we do not undo the progress we have achieved so far and the sacrifices each and every one of you has made to keep yourself and others safe.",en,[]
267,borisjohnson,2021-02-22,WATCH LIVE: My update to the @HouseOfCommons on the government’s roadmap for easing lockdown restrictions in England.  https://t.co/IJvvEHpHL1,en,[]
266,borisjohnson,2021-02-22,WATCH LIVE: An update on coronavirus (22 February 2021)  https://t.co/QYPbpZqZj9,en,[]
265,borisjohnson,2021-02-22,How we will cautiously ease the lockdown restrictions in England.   You can find more information here:  https://t.co/Q6naOuOtTq  https://t.co/JolhmaZ2UE,en,[]
269,borisjohnson,2021-02-22,Today I’ll be setting out a roadmap to bring us out of lockdown cautiously. Our priority has always been getting children back into school which we know is crucial for their education and wellbeing. We'll also be prioritising ways for people to reunite with loved ones safely.,en,[]
264,borisjohnson,2021-02-23,"Yesterday I set out our four-step roadmap to ease restrictions across England and provide a route back to a more normal way of life.  On Monday 8th March, schools and colleges across England will reopen, and teaching in classrooms can start again.   ➡️  https://t.co/0wMm3UFjLD  https://t.co/XGnKnFIxep",en,[]
263,borisjohnson,2021-02-23,"I want to thank farmers for keeping the UK fed throughout the pandemic.   You do incredible work, all day, in all weathers.   My full message to the @NFUtweets Conference #NFU21:  https://t.co/BYQXUQy8rA  https://t.co/I5M0Siyx3v",en,['nfu21']
262,borisjohnson,2021-02-23,"Today I chaired a @UN Security Council session on climate and security.  Together with Sir David Attenborough, I warned of the need to cut global emissions to net zero and help vulnerable countries adapt to climate change.  Read our remarks here:  https://t.co/7zlPA9pGJU  https://t.co/xmSPFqVpmQ",en,[]
256,borisjohnson,2021-02-24,"All countries need access to coronavirus vaccines, so it is fantastic to see the first doses from COVAX arriving in Ghana today.   I'm proud that the UK is one of the largest contributors to COVAX and that we will share the majority of any future surplus vaccines with the scheme.",en,[]
257,borisjohnson,2021-02-24,Over 18 million people across the United Kingdom have had their first jab.    We are aiming to offer a jab to all adults aged 50 or older and those who are at higher risk due to underlying health conditions by 15 April and every adult by the end of July.  https://t.co/dMMX2DfJsA,en,[]
255,borisjohnson,2021-02-24,Great to speak to @NOIweala and congratulate her on her appointment. The @WTO has a vital role to play in  championing free and fair trade as the world builds back better and greener from COVID-19.,en,[]
259,borisjohnson,2021-02-24,Thank you to the teachers and students at @SedgehillSch – and to schools all across the country - for all you have been doing throughout the pandemic.,en,[]
260,borisjohnson,2021-02-24,"The best place for young people’s future, and for their wellbeing, is back in the classroom.   With regular testing, children can safely return to school from 8 March.  https://t.co/1TD7OSG8I8",en,[]
258,borisjohnson,2021-02-24,It’s been great hearing about the issues that matter to you.   Please keep asking me your questions at  https://t.co/FBynuacYFP  https://t.co/nn5OGHIEEL,en,[]
261,borisjohnson,2021-02-24,"When schools re-open on 8 March, I want to make sure no child is left behind as a result of the learning they have lost over the past year.  A new £700m package of catch-up funding will help teachers support their pupils as they return to the classroom.   https://t.co/SX37ryPipF",en,[]
249,borisjohnson,2021-02-25,I answer your questions at the #PeoplesPMQs  https://t.co/H1nQzckcvi,en,['peoplespmqs']
250,borisjohnson,2021-02-25,Wishing a very happy and safe #Purim to Jewish communities across our United Kingdom and around the world. Chag Purim Sameach!,en,['purim']
254,borisjohnson,2021-02-25,No child should be left behind as a result of learning lost during the pandemic. That’s why students will receive grades awarded and determined by teachers.,en,[]
252,borisjohnson,2021-02-25,"Welcome news that rough sleeping has gone down by 43% since 2018 - but we won't rest until everyone in this country has a place to call home.   We are continuing to work with councils &amp; charities, providing £750m for programmes over the next year to end rough sleeping.",en,[]
253,borisjohnson,2021-02-25,This fair and flexible system will ensure all young people can progress to the next stage of their education or career.    https://t.co/6v8ENoHPhy,en,[]
251,borisjohnson,2021-02-25,Excellent trip to Accrington Academy in Lancashire today to see how they’re preparing for pupils to return on 8th March.    Our £700m catch up fund will ensure students across the country get the support they need to fulfil their potential.  https://t.co/B8i02Hgwru,en,[]
248,borisjohnson,2021-02-26,"Today Kuwait marks 30 years since its liberation from occupation. We remember those who gave their lives fighting bravely for freedom, including many British service personnel. I send my best wishes to our Kuwaiti friends as they celebrate their 60th National Day 🇰🇼🇬🇧",en,[]
247,borisjohnson,2021-02-27,This week I met with church and community leaders in Lewisham to discuss uptake of the COVID-19 vaccine.  https://t.co/a3Gb6WsBD0,en,[]
246,borisjohnson,2021-02-27,Congratulations to Wales on their impressive victory today and on taking home the Triple Crown.  #WALvENG,en,['walveng']
245,borisjohnson,2021-02-28,"20 million people across the UK have now got the jab – a huge national achievement and a testament to the tireless work of NHS staff, volunteers, the Armed Forces &amp; many more.   I urge everyone to get the jab when called. Every jab makes a difference in our battle against COVID.  https://t.co/kdkB2EkGlS",en,[]
244,borisjohnson,2021-03-01,"I would like to wish people in Wales and Welsh people around the world a very happy #StDavidsDay.   Diolch for everything that you’re doing throughout this pandemic, and Dydd Gŵyl Dewi Hapus! 🏴󠁧󠁢󠁷󠁬󠁳󠁿  https://t.co/QYQvVSnUtR",en,['stdavidsday']
243,borisjohnson,2021-03-01,"In Stoke-on-Trent today I saw the brilliant work being done to get children back to school safely next week.    Getting children back in school is the best thing for their education, wellbeing and development.  https://t.co/LR96raQIx2",en,[]
242,borisjohnson,2021-03-02,"Let's bring football home in 2030.  I would love for the home of football to host the 2030 World Cup, and it would be a wonderful thing for the whole country to savour.  We want to do much more to encourage sport post-pandemic and see a bonanza of football in the years ahead.",en,[]
241,borisjohnson,2021-03-03,"Throughout the pandemic we stepped in to protect jobs and livelihoods. This Budget continues that support and sets out our plan for growth.  We're investing in innovation, skills and infrastructure to build back better, level up and unleash the potential of the United Kingdom.",en,[]
237,borisjohnson,2021-03-04,Brilliant trip up to Teesside with Chancellor @RishiSunak.   A new Freeport here will create thousands of jobs. It’s all part of our plan to build back better and greener from the pandemic.  https://t.co/zctZYoDpND,en,[]
238,borisjohnson,2021-03-04,"I'm horrified by the escalation of violence in Myanmar and the killing of pro-democracy protesters.  We stand with the people of Myanmar in calling for an immediate end to military repression, the release of Aung San Suu Kyi and others, and the restoration of democracy.",en,[]
240,borisjohnson,2021-03-04,"I’ve been doing all I can to lose weight, and I'm not only fitter and healthier but also happier for it.  I'm pleased we’re investing £100 million into services to get the country healthier so we can all – quite literally – bounce back better.  https://t.co/twD2EYFwyR",en,[]
239,borisjohnson,2021-03-04,"From Scotch whisky distillers to Stilton-makers, the US decision to suspend tariffs on some UK exports today will benefit businesses right across the UK.   Fantastic news as we strengthen the UK-US trading relationship and work to build back better from the pandemic.",en,[]
235,borisjohnson,2021-03-05,"Today @DrAlexGeorge and I spoke with some young people from across the country, to hear about their experiences throughout the pandemic.   We have announced a £79 million support package for youth mental health and wellbeing.  https://t.co/vmngEtcEP5",en,[]
236,borisjohnson,2021-03-05,“We must never cease to proclaim in fearless tones the great principles of freedom and the rights of man.”   Churchill’s words in his famous Iron Curtain speech 75 years ago resonate as true today as they did in the post-war era. The UK stands by these values.,en,[]
234,borisjohnson,2021-03-07,"Pleased to see the removal of Nazanin Zaghari-Ratcliffe’s ankle tag, but her continued confinement remains totally unacceptable. She must be released permanently so she can return to her family in the UK, and we continue to do all we can to achieve this.",en,[]
233,borisjohnson,2021-03-07,I met some wonderful volunteers at @JesusHouseUK this morning who are spending their Sunday running a vaccination centre and protecting their local community.   Thank you to everyone across the UK who is playing their part to beat this virus.  https://t.co/eRRSImyq4z,en,[]
232,borisjohnson,2021-03-08,"Today pupils return to schools in England.  I want to thank teachers, parents, guardians and carers for the work you have done to keep kids learning throughout the pandemic.   Getting all schools back has been our priority and the first step of our roadmap back to normality.",en,[]
231,borisjohnson,2021-03-08,"This International Women’s Day I want to pay tribute to some of the leading figures in the UK’s vaccination programme.   Their ingenuity, dedication and hard work is an inspiration to all of us.   #InternationalWomensDay #IWD2021 #ExtraordinaryWomen  https://t.co/CDJWpS5RUX",en,"['internationalwomensday', 'iwd2021', 'extraordinarywomen']"
230,borisjohnson,2021-03-08,"I’m proud to see the Commonwealth flag raised over No 10 today.   Commonwealth Day is an opportunity to celebrate this great family of nations and our joint efforts to promote prosperity, sustainability, equality and security across 54 countries.   #CommonwealthDay",en,['commonwealthday']
229,borisjohnson,2021-03-08,Great to welcome @ClimateEnvoy John Kerry back to London today and discuss our joint efforts to protect our planet.  The UK and US have an exciting shared agenda to drive down global emissions ahead of @COP26 in November.  🇬🇧🇺🇸  https://t.co/gIssFE6EWL,en,[]
228,borisjohnson,2021-03-08,WATCH LIVE: #Coronavirus press conference (8 March 2021)  https://t.co/YINyoTjXam,en,['coronavirus']
227,borisjohnson,2021-03-09,"Last week I met with healthcare professionals who are working tremendously hard to boost vaccine confidence amongst ethnic minority groups.    It is vital that we continue to encourage everyone, in every community, to come forward to take the vaccine when it is their turn.  https://t.co/Fzk1xhnzFq",en,[]
226,borisjohnson,2021-03-10,"The UK is united by so many ties of people, history, culture, business and much more.  We are at our best when all four parts fire on all cylinders. With @SirPeterHendy’s transport connectivity review, we can make our economy and Union stronger than ever before 🇬🇧  https://t.co/yZTJOmBXlo",en,[]
225,borisjohnson,2021-03-11,I am shocked and deeply saddened by the developments in the Sarah Everard investigation. Like the whole country my thoughts are with her family and friends. We must work fast to find all the answers to this horrifying crime.,en,[]
224,borisjohnson,2021-03-12,It was a privilege to speak to @NHSVolResponder and @StJohnAmbulance volunteers from Rochdale and Cornwall yesterday.    They've helped get jabs into arms quickly and efficiently. We couldn’t do it without them. I am very grateful for their continued dedication.  https://t.co/RzssfVW4Rz,en,[]
223,borisjohnson,2021-03-12,Great to be in Northern Ireland today seeing the incredible work being done to tackle COVID and get jabs into arms – from Belfast to Enniskillen.  https://t.co/fq3Zrvorge,en,[]
219,borisjohnson,2021-03-13,I will do everything I can to make sure the streets are safe and ensure women and girls do not face harassment or abuse.,en,[]
220,borisjohnson,2021-03-13,Tonight Carrie and I will be lighting a candle for Sarah Everard and thinking of her family and friends. I cannot imagine how unbearable their pain and grief is. We must work fast to find all the answers to this horrifying crime.,en,[]
222,borisjohnson,2021-03-13,"The brutal murder of 16 primary school children and their teacher in Dunblane 25 years ago shocked the world. We must never forget all those who lost their lives on that terrible day.  Today my thoughts are with the bereaved, the survivors, and the whole Dunblane community.",en,[]
221,borisjohnson,2021-03-13,I know how difficult it has been for this generation of university students.    We are going to do our best to make it up to you.,en,[]
218,borisjohnson,2021-03-14,I want to say a massive thank you to all the people of Northern Ireland for everything they've been doing during the pandemic.  Together we will build back better.  https://t.co/y4u3ZeMZWx,en,[]
217,borisjohnson,2021-03-15,"Buses are lifelines and liberators, connecting people to jobs they couldn't otherwise take, sustaining town centres and protecting the environment.   As we build back from the pandemic, better buses will be one of our first acts of levelling up.",en,[]
216,borisjohnson,2021-03-15,"This evening I met with ministers, senior police officers and @CPSUK to discuss further steps needed to protect women and girls and make sure our streets are safe.  The horrific case of Sarah Everard has unleashed a wave of feeling about women not feeling safe at night.",en,[]
215,borisjohnson,2021-03-15,"We're taking action to make our streets safer, with better lighting and CCTV, tougher sentences and increased police patrols.  We must drive out violence against women and girls and make every part of the criminal justice system work better to protect and defend them.",en,[]
213,borisjohnson,2021-03-16,"We’re going to level up bus services across the country, making them cheaper, greener and more reliable.   Great to be at the @NationalExpress Coventry depot to launch our National Bus Strategy yesterday.  https://t.co/Miz5VJAWud",en,[]
212,borisjohnson,2021-03-16,"The objective of Global Britain is to use the full spectrum of our abilities, now amplified by record spending on both defence and science, to engage with and help the rest of the world.  My article on the #IntegratedReview:  https://t.co/RogZpwrhPW  https://t.co/bbLgYr6eve",en,['integratedreview']
211,borisjohnson,2021-03-16,WATCH LIVE: My statement in the @HouseOfCommons on the #IntegratedReview  https://t.co/c2Om14ZgsJ,en,['integratedreview']
210,borisjohnson,2021-03-16,Today we have published the #IntegratedReview – the most comprehensive survey of the UK’s foreign policy and national security in decades.  It's all part of our vision to unite and level up our country 🇬🇧  https://t.co/GZfmPpDqW7,en,['integratedreview']
209,borisjohnson,2021-03-17,"I’d like to wish everyone in Northern Ireland, Ireland and Irish people around the world a very happy St Patrick’s Day!    #StPatricksDay  https://t.co/49siHRwWoM",en,['stpatricksday']
208,borisjohnson,2021-03-17,"The latest milestone is an incredible achievement – representing 25 million reasons to be confident for the future as we cautiously reopen society.    Thank you to the brilliant NHS, scientists, armed forces, volunteers and all those who’ve helped our rollout.  https://t.co/bR9sGMU3bo",en,[]
207,borisjohnson,2021-03-17,"I'm sorry to hear that @MagufuliJP, President of Tanzania, has passed away. My thoughts are with his loved ones and the people of Tanzania.",en,[]
202,borisjohnson,2021-03-18,The Oxford/AstraZeneca jab is safe and the Pfizer jab is safe - the thing that isn’t safe is catching COVID.   Which is why it’s so important that we all get our jabs as soon as our turn comes.  https://t.co/WREOjG4FIX,en,[]
203,borisjohnson,2021-03-18,WATCH LIVE: An update on coronavirus (18 March 2021)  https://t.co/TwDIbvwJpE,en,[]
204,borisjohnson,2021-03-18,Congratulations @MarkRutte on winning the largest vote share in yesterday's election in the Netherlands. The UK and the Netherlands are close partners and old friends and I look forward to continuing to work with you in the coming years.  🇬🇧🇳🇱,en,[]
206,borisjohnson,2021-03-18,We are doing everything in our power to protect the most vulnerable in our society.   That is why we are investing £212m in a scheme to create homes and provide specialised support dedicated to helping rough sleepers rebuild their lives.    https://t.co/l5oEtPqcyX,en,[]
205,borisjohnson,2021-03-18,"Today I visited Colham Manor Primary School in my constituency.   Huge thanks to everyone who has worked so hard to get children back into the classroom. School is the best place for their education, wellbeing and development.  https://t.co/cfKp1PK85m",en,[]
200,borisjohnson,2021-03-19,Spoke to @MarkRutte this afternoon to congratulate him on his re-election. The UK and the Netherlands will continue to be close partners and I look forward to working with Mark in the coming years 🇬🇧🇳🇱,en,[]
198,borisjohnson,2021-03-19,"I’ve just had my first AstraZeneca vaccine.  Get your jab when you’re asked to do so. It’s good for you, it’s good for your family and it’s a great thing for the whole country.  https://t.co/pc5tnY9PGK",en,[]
201,borisjohnson,2021-03-19,The sheer endurance and determination of @BillyMonger in his 140 mile challenge for @ComicRelief is an inspiration to us all.   Thank you Billy and everyone who is supporting this important cause.   #RedNoseDay,en,['rednoseday']
199,borisjohnson,2021-03-19,"I've just received my first Oxford/AstraZeneca vaccine dose.  Thank you to all of the incredible scientists, NHS staff and volunteers who helped make this happen.  Getting the jab is the best thing we can do to get back to the lives we miss so much.  Let's get the jab done.  https://t.co/mQCTMAkB8d",en,[]
197,borisjohnson,2021-03-20,More than half the adult population of the UK have now received their first jab.   Many thanks to everyone involved in this fantastic achievement. Let’s keep going!  https://t.co/cf9kWThmuM,en,[]
196,borisjohnson,2021-03-21,"Yesterday was a record-breaking day for the vaccine rollout, with 873,784 people receiving a jab.   A huge thank you to everyone involved and please come forward to get your jab when you are invited to do so.",en,[]
195,borisjohnson,2021-03-22,"Fantastic to visit @BAESystemsplc in Warton.   Our £24bn investment in security and defence will modernise our Armed Forces, creating jobs and securing our place as a science superpower.  https://t.co/lNInD0ibT7",en,[]
194,borisjohnson,2021-03-23,"Today, the anniversary of the first lockdown, is an opportunity to reflect on the past year – one of the most difficult in our country’s history.  https://t.co/Y7yt8OoRMW",en,[]
193,borisjohnson,2021-03-23,WATCH LIVE: An update on coronavirus (23 March 2021)  https://t.co/vTeh0ng1EO,en,[]
192,borisjohnson,2021-03-23,"Cautiously but irreversibly, step by step, jab by jab, this country is on the path to reclaiming our freedoms.  https://t.co/rJeCil9lit",en,[]
191,borisjohnson,2021-03-24,"Today we take a positive step forward in our commitment to tackle illegal entry, punish people smugglers and safeguard those who are in genuine need of refuge.   This is our fair but firm New Plan for Immigration ⬇️",en,[]
190,borisjohnson,2021-03-25,Best wishes to the people of Greece on the 200th anniversary of the Greek Revolution. The UK was proud to play its part in the establishment of the modern Greek state and I greatly value the friendship that exists between our people today 🇬🇧🇬🇷,en,[]
189,borisjohnson,2021-03-25,"It was fantastic to meet the children, parents and staff at Monkey Puzzle Nursery in Greenford today.  https://t.co/W6AtZuIUsg",en,[]
188,borisjohnson,2021-03-26,The MPs and other British citizens sanctioned by China today are performing a vital role shining a light on the gross human rights violations being perpetrated against Uyghur Muslims.   Freedom to speak out in opposition to abuse is fundamental and I stand firmly with them.,en,[]
187,borisjohnson,2021-03-26,"I want to congratulate the people of Bangladesh on your 50th anniversary.   The bond between our two nations is incarnated by the 600,000 strong British-Bangladeshi community, who contribute so much to our country 🇬🇧🇧🇩  #Bangladesh50 #BritBanglaBondhon  https://t.co/kIw0BSFWtF",en,"['bangladesh50', 'britbanglabondhon']"
186,borisjohnson,2021-03-26,"Chag kasher v’sameach to everyone celebrating #Passover.  While families, friends and neighbours can't come together as they usually would, I know our fantastic Jewish community - known for its strength and resilience – will celebrate this Pesach safely.  https://t.co/lQfCIDZV2K",en,['passover']
182,borisjohnson,2021-03-27,"If you are in need of support, or if you are concerned about a friend or family member, there is help available:  https://t.co/tHBIQW32xB",en,[]
184,borisjohnson,2021-03-27,This morning I spoke with some of those who have been shining a light on the gross human rights violations being perpetrated against Uyghur Muslims.  I stand firmly with them and the other British citizens sanctioned by China.  https://t.co/WsQ3XvAedP,en,[]
185,borisjohnson,2021-03-27,"Last night saw disgraceful attacks against police officers in Bristol.   Our officers should not have to face having bricks, bottles and fireworks being thrown at them by a mob intent on violence and causing damage to property.  The police and the city have my full support.",en,[]
183,borisjohnson,2021-03-27,"We’re investing £500m in mental health services, which will expand NHS talking therapies to an additional 1.6 million people.    We recognise the impact this pandemic has had on wellbeing and are dedicated to providing better mental health support for those in need.  https://t.co/lN4XatF4Sq",en,[]
181,borisjohnson,2021-03-28,Wonderful news that over 30 million people have received their first dose.  We need to keep up the momentum. Please make sure you get your second dose when you are called to do so.  https://t.co/zAZfaIEHNW,en,[]
180,borisjohnson,2021-03-28,"Ahead of outdoor organised sport returning across England tomorrow, good luck to everyone getting back to the sports you love – from football to netball and much more.   After a difficult few months, it’s great that so many will be able to get back out there.  https://t.co/dPED46vpPp",en,[]
179,borisjohnson,2021-03-29,Today marks the next stage of our roadmap to cautiously ease restrictions in England.  As vaccines are being rolled out it’s vital that we don’t overdo it and risk all the progress we’ve made.   Please follow the new rules carefully.  https://t.co/9r7aV9hYb7,en,[]
178,borisjohnson,2021-03-29,WATCH LIVE: an update on COVID-19 (29 March 2021)  https://t.co/1sKp0mNg85,en,[]
177,borisjohnson,2021-03-30,The vaccine is our best route out of this pandemic and we must all do our part by taking the vaccine when it is offered to us.  Thank you Sir @LennyHenry for speaking up on this important issue.,en,[]
