,username,date,tweet,language,hashtags
587,borisjohnson,2020-09-30,Now is the time to fix the system – and to make the fundamental changes that will improve outcomes and outputs for decades to come.  My plan to transform our country’s training and skills system:  https://t.co/jRXjkuYqq8  https://t.co/NNr93FIM5H,en,[]
586,borisjohnson,2020-09-30,Labour see this virus as a “good crisis” to exploit.  We will work to defeat it together and take this country forward 🇬🇧  https://t.co/nefqoHelIB,en,[]
585,borisjohnson,2020-10-01,"No matter how impatient we may be, how fed up we may become – there is only one way of defeating this virus.    And that’s by showing a collective forbearance, common sense and willingness to make sacrifices for the safety of others.  https://t.co/jeqjgq3kwA",en,[]
584,borisjohnson,2020-10-01,"Together we will fight back against this virus, protect our NHS, and save many more lives.  https://t.co/lQCMlglowL",en,[]
583,borisjohnson,2020-10-01,"This #BlackHistoryMonth let’s say thank you to figures from our past we haven’t always thanked before.   Black history is our history, and if we all learn from it, we will build a better future for us all. #OurHistoryOurHeroes  https://t.co/PXWmGbl6o3",en,"['blackhistorymonth', 'ourhistoryourheroes']"
580,borisjohnson,2020-10-02,Saturday marks the start of this year’s 𝐂𝐨𝐧𝐬𝐞𝐫𝐯𝐚𝐭𝐢𝐯𝐞 𝐏𝐚𝐫𝐭𝐲 𝐂𝐨𝐧𝐟𝐞𝐫𝐞𝐧𝐜𝐞.  You can watch our keynote speakers live on @Conservatives channels throughout Conference to hear more about how we're going to #BuildBackBetter.  Join us for #CPC20!  https://t.co/8xUvKntVut,en,"['buildbackbetter', 'cpc20']"
579,borisjohnson,2020-10-02,"From Morpeth to Milton Keynes, we are building 40 new hospitals across England to level up our NHS so more people have top-class healthcare in their local area.   We will build back better with the biggest hospital building programme in a generation.    https://t.co/vtixL5HShp  https://t.co/kBhEd719R6",en,[]
582,borisjohnson,2020-10-02,My best wishes to President Trump and the First Lady. Hope they both have a speedy recovery from coronavirus.,en,[]
581,borisjohnson,2020-10-02,"We will get through this - but only if we work together.    Continue to follow the rules, download the #NHSCOVID19app – and together we will fight back against this virus, protect our NHS and save many more lives.",en,['nhscovid19app']
578,borisjohnson,2020-10-04,We were elected in 2019 to change this country for the better - and that’s what we’re going to do.    #BuildBackBetter #CPC20  https://t.co/PTfRUG3zLX,en,"['buildbackbetter', 'cpc20']"
577,borisjohnson,2020-10-05,Teachers have gone above and beyond throughout these past few months – keeping children learning in unprecedented circumstances &amp; crucially getting them back to school this September.   Thank you for all of your hard work and dedication.  #WorldTeachersDay,en,['worldteachersday']
576,borisjohnson,2020-10-05,"Brilliant to be at @Octopus_Energy today with @RishiSunak.   It's UK tech companies like Octopus that will ensure we continue to build back greener, pioneering renewable energy globally and leading the path to Net Zero, whilst creating thousands of jobs.  https://t.co/vqjecDR3UJ",en,[]
575,borisjohnson,2020-10-06,"It falls to this generation, and this Government, to take this opportunity now to transform our country and #BuildBackBetter 🇬🇧   Tune in at 11:30am to watch my speech at Conservative Party conference. #CPC20  https://t.co/nOIm1GonhH",en,"['buildbackbetter', 'cpc20']"
574,borisjohnson,2020-10-06,"We will become the world leader in low cost, clean power generation.  In ten years time, offshore wind will be powering every home in the country.   #BuildBackBetter #CPC20  https://t.co/8mkWrQwknX",en,"['buildbackbetter', 'cpc20']"
573,borisjohnson,2020-10-06,"We are going to defeat this virus, and transform this country for the better 🇬🇧 #BuildBackBetter  https://t.co/XMYzeQ4pd0",en,['buildbackbetter']
572,borisjohnson,2020-10-07,We are taking the tough decisions to save lives and protect our NHS through this pandemic. #PMQs  https://t.co/lyek1oSts3,en,['pmqs']
569,borisjohnson,2020-10-08,"The @EarthshotPrize is a fantastic initiative by @KensingtonRoyal, bringing together some of the brightest minds to find solutions to some of the world’s greatest environmental problems.",en,[]
571,borisjohnson,2020-10-08,"During the pandemic our local, regional and national newspapers have proved indispensable in keeping communities reliably informed and I urge everyone to support the @newsmediaorg Journalism Matters campaign.   #JournalismMatters",en,['journalismmatters']
570,borisjohnson,2020-10-08,"The UK is Ukraine’s most fervent supporter.   Whether it’s our defence support, stabilisation efforts, humanitarian assistance or close cooperation on political issues, our message is clear – we are utterly committed to upholding Ukraine's sovereignty and territorial integrity.",en,[]
568,borisjohnson,2020-10-09,Congratulations to the @WFP on winning this year’s Nobel Peace Prize. The UK 🇬🇧 is proud to support its life-saving work in fighting hunger and famine worldwide.   #NobelPeacePrize,en,['nobelpeaceprize']
567,borisjohnson,2020-10-10,"“We measure our friendships by how they show up in bad weather.” - Sir Winston Churchill   Let’s show up for our family, our friends, our colleagues, and our community - and weather the storm together.    #WorldMentalHealthDay  https://t.co/HyFddh4wku",en,['worldmentalhealthday']
566,borisjohnson,2020-10-10,"Today we recognise the local, often unsung heroes, whose hard work and dedication has helped carry us through this pandemic. Their care, compassion and resolve is truly a testament to the sort of country we are.    Congratulations to all Honours recipients.",en,[]
565,borisjohnson,2020-10-11,There is a real risk of a lost generation of girls never returning to school. We cannot let that happen.   Our global recovery from the pandemic must leave no one behind.    On #DayOfTheGirl I urge global action to stand up for every girl’s right to 12 years of quality education.,en,['dayofthegirl']
564,borisjohnson,2020-10-12,WATCH LIVE: An update on coronavirus (12 October 2020)  https://t.co/hyzM4BhQNT,en,[]
563,borisjohnson,2020-10-13,"We’re simplifying and standardising local rules in England by introducing three Local COVID Alert levels, with each level accompanied by proportionate restrictions.   Find out the Local COVID Alert level in your area with the postcode checker:  https://t.co/D0fLdDshoe  https://t.co/QppGV1Uj94",en,[]
562,borisjohnson,2020-10-14,"Good to meet with @Minette_Batters today. I will always support our fantastic farmers, who have worked tirelessly during the pandemic to keep our country fed. Outside the EU we now have the chance to get a better, fairer deal for Britain’s food and farming sector.  https://t.co/tf6KtWx2UR",en,[]
559,borisjohnson,2020-10-16,"Over the next few weeks, new rapid COVID-19 tests will be trialled across the country. This will enable us to test NHS and care home staff much more frequently.  https://t.co/suIjMhUCt1",en,[]
561,borisjohnson,2020-10-16,My update on our negotiations with the EU.   https://t.co/1yPBFWgxcn,en,[]
560,borisjohnson,2020-10-16,WATCH LIVE: An update on coronavirus. (16 October 2020)  https://t.co/TrPvFPQDnf,en,[]
558,borisjohnson,2020-10-17,"Congratulations @jacindaardern for winning a second term as New Zealand PM. From our work together to tackle climate change to forging an exciting new trade partnership, the UK and NZ have great things to look forward to in the future.",en,[]
557,borisjohnson,2020-10-20,WATCH LIVE: An update on coronavirus. (20 October 2020)  https://t.co/ZgJZoPBM2C,en,[]
556,borisjohnson,2020-10-21,Great to meet some of our Black service personnel yesterday. A reminder during #BlackHistoryMonth that many Black Britons fighting for🇬🇧were never recognised for their service.  Black history is our history - and Britain has been made all the greater for it.  https://t.co/1gYJfUG3K1,en,['blackhistorymonth']
555,borisjohnson,2020-10-22,Keeping active this year has been challenging for all of us.  Thanks to everyone who is working tirelessly to help run activities &amp; sports in these trying times and well done to those who are out there taking part. Keep going!,en,[]
554,borisjohnson,2020-10-22,"We are wrapping our arms around the country to give people the support they need to get through this.  That's why @RishiSunak is extending the Job Support Scheme, giving the self-employed more assistance &amp; expanding business grants to support companies in high-alert level areas.",en,[]
553,borisjohnson,2020-10-22,WATCH LIVE: An update on coronavirus (22 October 2020)  https://t.co/rHRD71Km5t,en,[]
552,borisjohnson,2020-10-22,"We need to protect jobs, protect livelihoods and put the UK in the strongest position for an economic recovery.  https://t.co/cjBVvbB23s",en,[]
551,borisjohnson,2020-10-22,"Brilliant news that there are now 13,718 more nurses and 7,810 more doctors than a year ago - these figures show we’re on course to keep our manifesto commitments. And thank you to the incredible NHS staff who are always there for us, especially in this difficult time.  https://t.co/vG56HjskQj",en,[]
550,borisjohnson,2020-10-23,We will not let these difficult times stop us from doing proper honour to those who gave their lives for our freedom and safety.  Make sure you buy a poppy this year - be it online or at the supermarket - to support the families of those who have given so much.  #EveryPoppyCounts  https://t.co/kCnLOvShNE,en,['everypoppycounts']
549,borisjohnson,2020-10-23,"A historic moment as we formally sign the UK-Japan Comprehensive Economic Partnership Agreement, marking a new era of friendship between our nations. 🇬🇧🇯🇵  This will bring extraordinary opportunities to the UK – boosting jobs and prosperity for businesses and consumers.",en,[]
548,borisjohnson,2020-10-26,Great to see Japan’s commitment to reach #NetZero by 2050. I look forward to working closely with Prime Minister @sugawitter and @JapanGov to tackle climate change in the run up to @COP26 in Glasgow next year 🇬🇧🇯🇵,en,['netzero']
547,borisjohnson,2020-10-26,"Fantastic to visit the Royal Berkshire Hospital with @PrueLeith today, taking forward her recommendations to improve food in our hospitals. An important step to improve our long-term health.  https://t.co/FqzEt3tuHH",en,[]
546,borisjohnson,2020-10-27,Great call with my friend @ScottMorrisonMP this morning. Whether it’s boosting trade between great nations or developing cutting-edge technology to tackle climate change - the UK and Australia are partners in building back better from coronavirus.  🇬🇧🇦🇺,en,[]
545,borisjohnson,2020-10-27,My statement on those who tragically lost their lives in the Channel today.  https://t.co/W7zT5NKINr,en,[]
544,borisjohnson,2020-10-28,Wonderful news that President Moon @moonriver365 has committed to reaching #NetZero by 2050. South Korea's ambitious pledge shows clear momentum ahead of @COP26 - I look forward to 🇬🇧 and 🇰🇷 working together for our planet 🌍,en,['netzero']
541,borisjohnson,2020-10-29,"Brilliant news that we have recruited an extra 5,824 police officers in the last year. We're on track to hit our target of 6,000 by March 2021 &amp; 20,000 over the next 3 years.   I’m committed to keeping our streets safe &amp; supporting our police is at the heart of that commitment.  https://t.co/Jktruyto2T",en,[]
543,borisjohnson,2020-10-29,"I am appalled to hear the news from Nice this morning of a barbaric attack at the Notre-Dame Basilica. Our thoughts are with the victims and their families, and the UK stands steadfastly with France against terror and intolerance.",en,[]
530,borisjohnson,2020-10-31,You can read my full statement with further details on the measures announced today here:  https://t.co/ElYLlEpNeY (10/10),en,[]
531,borisjohnson,2020-10-31,"We will get through this - but we must act now to contain the spread of coronavirus.    While Christmas will be very different this year, it is my sincere hope and belief that by taking tough action now, we can allow families across the country to be together. (9/10)",en,[]
533,borisjohnson,2020-10-31,"These measures will be time-limited, starting next Thursday 5 November. They will end on Wednesday 2 December, when we will seek to ease restrictions on a local and regional basis according to the latest data and trends. (7/10)",en,[]
534,borisjohnson,2020-10-31,I urge parents to continue taking their children to school and am so grateful to teachers for their dedication in enabling schools to remain open. (6/10),en,[]
532,borisjohnson,2020-10-31,I want to thank the millions of people who have been putting up with restrictions for so long. I know how difficult this has been for everyone. (8/10),en,[]
536,borisjohnson,2020-10-31,"Single adult households can still form exclusive support bubbles with one other household, and children will still be able to move between homes if their parents are separated. (4/10)",en,[]
537,borisjohnson,2020-10-31,"You may leave your home for work, for exercise, with your household or on your own with one person from another household, to shop for food and essentials, for medical care and to provide care for others. (3/10)",en,[]
538,borisjohnson,2020-10-31,"We must take action now to protect our NHS. In England, from Thursday until the start of December, you must stay at home.    Non-essential shops, leisure &amp; entertainment venues will be closed. Pubs, bars &amp; restaurants must close except for takeaway and delivery services. (2/10)",en,[]
539,borisjohnson,2020-10-31,"In this country, as across much of Europe, the virus is spreading even faster than the reasonable worst case scenario of our scientific advisers.   If we fail to take action, then there is a real risk of depriving non-Covid patients of the care that they need from the NHS (1/10)",en,[]
535,borisjohnson,2020-10-31,"Childcare, early years settings, schools, colleges and universities will all remain open. Our senior clinicians still advise that school is the best place for children to be. (5/10)",en,[]
540,borisjohnson,2020-10-31,WATCH LIVE: An update on coronavirus (31 October 2020)  https://t.co/IRsPKZ5kIR,en,[]
529,borisjohnson,2020-11-02,"We will get through this - but we must act now to contain the spread of coronavirus.  It is my sincere hope and belief that by taking tough action now, we can allow families across the country to be together.  https://t.co/81yGUSYcB7",en,[]
528,borisjohnson,2020-11-02,"10 years on from the historic Lancaster House Treaties, the UK’s defence and security partnership with France is stronger than ever. We are neighbours and natural allies, and together we work every single day to make the world a safer place.",en,[]
527,borisjohnson,2020-11-02,"For the next four weeks I must ask the people of this country to come together, to protect the NHS, and to save lives.  https://t.co/Qv1Lm8ygFj",en,[]
526,borisjohnson,2020-11-02,I am deeply shocked by the terrible attacks in Vienna tonight. The UK’s thoughts are with the people of Austria - we stand united with you against terror.,en,[]
522,borisjohnson,2020-11-03,We now have a system of mass testing - starting in the great city of Liverpool - which I believe will help this country defeat this virus.  https://t.co/4ZqKy0UQdK,en,[]
524,borisjohnson,2020-11-03,"These tests will help identify the many thousands of people in the city who don’t have symptoms, but who can still infect others without knowing. (2/3)",en,[]
525,borisjohnson,2020-11-03,I want to thank Liverpool’s leaders for volunteering to join the UK’s first city-wide population testing pilot and the people of Liverpool for taking part. (1/3),en,[]
523,borisjohnson,2020-11-03,"Dependent on the pilot’s success, we will aim to distribute millions of these new rapid tests between now and Christmas and allow local communities to drive down transmission in their areas. (3/3)",en,[]
521,borisjohnson,2020-11-05,WATCH LIVE: An update on coronavirus (5 November 2020)  https://t.co/9fBoVPoYaq,en,[]
520,borisjohnson,2020-11-05,I understand that these measures are tough but they are time-limited.    There is light at the end of the tunnel and we will get through this together.  https://t.co/wp3bqVfnLQ,en,[]
519,borisjohnson,2020-11-06,"Thank you to all of our brilliant scientists at @UniOfOxford, @AstraZeneca &amp; across the UK who are working tirelessly to find a vaccine and to all those who have volunteered to take part in a clinical trial.    This government - and the whole country - are backing you 100% 🇬🇧",en,[]
518,borisjohnson,2020-11-06,Thank you to everyone in Liverpool for the fantastic response to the mass testing pilot and to all those - including our Armed Forces personnel - for helping to make this happen.  It is early days but together we can drive down the virus.  https://t.co/j0cR6bOUn1,en,[]
517,borisjohnson,2020-11-06,Please show your support for the @PoppyLegion  #PoppyAppeal by donating here:  https://t.co/sWm36MYG8C,en,['poppyappeal']
516,borisjohnson,2020-11-07,Congratulations @JoeBiden and @KamalaHarris  https://t.co/xrpE99W4c4,en,[]
515,borisjohnson,2020-11-07,"I am deeply saddened by the passing of Rabbi Lord Jonathan Sacks. His leadership had a profound impact on our whole country and across the world. My sincere condolences to his family, friends and the Jewish community. May his memory be a blessing.",en,[]
514,borisjohnson,2020-11-08,"No virus will stop us from honouring the memory of the servicemen and women who sacrificed their lives for our freedom.   Today, as every day, we will remember them.   #LestWeForget  https://t.co/PuQz2I8NP8",en,['lestweforget']
513,borisjohnson,2020-11-08,"Today we show that in this time of adversity, no virus can stop us from honouring the memory of the servicemen and women from Britain and the Commonwealth to whom we owe so much. #LestWeForget  https://t.co/0rP6YeQ846",en,['lestweforget']
512,borisjohnson,2020-11-09,WATCH LIVE: An update on coronavirus. (9 November 2020)  https://t.co/nOsl1W9KsF,en,[]
511,borisjohnson,2020-11-09,"If and when the @Pfizer &amp; @BioNTech_Group vaccine is approved, we will be ready to start using it.  But the biggest mistake we could make now would be to slacken our resolve at such a critical moment.  We must continue to work together to protect our NHS and save lives.  https://t.co/C4OOjCvtVF",en,[]
510,borisjohnson,2020-11-10,Huge thanks to Kate Bingham and the Vaccine Taskforce for all their fantastic work in securing 40 million doses of the @pfizer &amp; @BioNTech_Group vaccine and over 300 million doses of other promising vaccine candidates.,en,[]
509,borisjohnson,2020-11-10,"I just spoke to @JoeBiden to congratulate him on his election. I look forward to strengthening the partnership between our countries and to working with him on our shared priorities – from tackling climate change, to promoting democracy and building back better from the pandemic.",en,[]
505,borisjohnson,2020-11-11,We are delivering on the promise we made to the British people to take back control of our borders and implement a fair and firm immigration system.  https://t.co/vsbzfOBWAP,en,[]
507,borisjohnson,2020-11-11,We are delivering on the will of the British people by ending free movement and introducing a fair points-based immigration system 🌎 #PMQs  https://t.co/V1PK5UeZ3z,en,['pmqs']
508,borisjohnson,2020-11-11,Today we remember all our servicemen and women who made the ultimate sacrifice.  Lest we forget.   #ArmisticeDay  https://t.co/1l1PkCK8mR,en,['armisticeday']
506,borisjohnson,2020-11-11,"I was saddened to hear of the death of Dr Saeb Erekat, and moved by the ceremonies today in Ramallah and Jericho. He dedicated his life to dialogue and advanced the cause of peace and Palestinian rights against the odds. My thoughts are with his family and the Palestinian people.",en,[]
504,borisjohnson,2020-11-12,"Our fantastic Kickstart Scheme has created 19,000 jobs for young people across the UK - from fitness to social care to TV &amp; film.  Young people are our future and we are determined to make sure they can kickstart their careers as we build back better from the pandemic.  https://t.co/l2qvnNbB7w",en,[]
503,borisjohnson,2020-11-12,We're one year out from hosting @COP26 in Glasgow. There is no time to waste and we have to act now to take bold action in the fight against climate change.  I'm looking forward to shortly setting out my ten-point plan to create thousands of green jobs in the UK.,en,[]
502,borisjohnson,2020-11-12,So great to see Scotland going forward to the Euros. Massive well done to the whole team 🏴󠁧󠁢󠁳󠁣󠁴󠁿 #SERSCO #Euro2020,en,"['sersco', 'euro2020']"
501,borisjohnson,2020-11-13,"I’m delighted that the United Kingdom has now protected more than 4.3 million sq km of the world’s ocean.  With the announcement of Tristan da Cunha’s new Marine Protection Zone, we have helped to protect an area of ocean 17 times the size of the UK.   https://t.co/A02eD5uWkf  https://t.co/BRNt66vfwJ",en,[]
500,borisjohnson,2020-11-14,"Happy #Diwali and #BandiChhorDivas!  I know that this year celebrations will be different, but I am filled with respect for the way British Hindus, Sikhs and Jains have gone out of their way to help others throughout this pandemic.  https://t.co/YhqWpq3JQH",en,"['diwali', 'bandichhordivas']"
499,borisjohnson,2020-11-15,An impressive victory - well done @LewisHamilton! You have made us all so proud 🇬🇧,en,[]
498,borisjohnson,2020-11-15,"Today I was notified by NHS Test and Trace that I must self-isolate as I have been in contact with someone who tested positive for COVID-19.   I have no symptoms, but am following the rules and will be working from No10 as I continue to lead the government’s pandemic response.",en,[]
497,borisjohnson,2020-11-16,"Hi folks, I’ve been instructed by our NHS Test &amp; Trace scheme to self-isolate for two weeks, after being in contact with someone with Covid-19.   I’m in good health and have no symptoms, and will continue to lead on our response to the virus &amp; our plans to #BuildBackBetter  https://t.co/yNgIme8lOz",en,['buildbackbetter']
496,borisjohnson,2020-11-16,"Fantastic news that the Vaccine Taskforce has secured an initial agreement for 5 million doses of the Moderna vaccine, in addition to over 350 million doses of other promising vaccine candidates.",en,[]
495,borisjohnson,2020-11-18,"Powered by the wind turbines of Scotland and the North East, propelled by electric cars made in the Midlands and advanced by tech developed in Wales, my 10 point plan will drive forward a Green Industrial Revolution, creating jobs across the country.    https://t.co/98ZbUFZzrT  https://t.co/CwXmaxM1R3",en,[]
494,borisjohnson,2020-11-18,"We are going to drive forward a Green Industrial Revolution, creating hundreds of thousands of green jobs across the country.  Read more about my 10 point plan:  https://t.co/ZnqoHnbzB7",en,[]
493,borisjohnson,2020-11-18,"Like many organisations, the @HouseOfCommons has adapted well to remote working!    Great to take questions from MPs today at #PMQs   Image: @UKParliament / Jessica Taylor  https://t.co/s64pe8ex8m",en,['pmqs']
490,borisjohnson,2020-11-19,Our Armed Forces represent the very best of our country.   We are ending the era of retreat and strengthening our defence budget with £16.5 billion over the next four years.     https://t.co/SWRzM8Pdhu  https://t.co/rH30RoQYeD,en,[]
491,borisjohnson,2020-11-19,We are investing an extra £16.5 billion to defend our people and way of life 🇬🇧  https://t.co/PFWaV0t4rK,en,[]
492,borisjohnson,2020-11-19,"The defence of the realm is the first duty of government.   We are investing an extra £16.5 billion in defence to end the era of retreat, strengthen our Armed Forces, and extend British influence as a force for good in the world 🇬🇧    https://t.co/SWRzM8Pdhu  https://t.co/j9EARz2DV9",en,[]
489,borisjohnson,2020-11-20,"Fantastic news that we've secured satellite network @OneWeb. This strategic investment will drive our space sector and put the UK at the forefront of space tech. A terrific boost to our advanced manufacturing, services and tech industries.",en,[]
487,borisjohnson,2020-11-21,"As the #G20 meets this weekend, we must recommit to do whatever it takes to overcome the pandemic and protect lives and livelihoods.   If we harness the collective ingenuity and resources of the G20, we can chart a path out of the pandemic and build a better, greener future.",en,['g20']
485,borisjohnson,2020-11-21,"Great to speak with @JustinTrudeau, @mary_ng and @trussliz today to secure a fantastic trade agreement for Britain.    British businesses export everything from electric cars to sparkling wine to Canada, and today’s deal will ensure that trade goes from strength to strength. 🇬🇧🇨🇦  https://t.co/3Ulmva0GLi",en,[]
488,borisjohnson,2020-11-21,"Hi folks, quick update from me. Still self-isolating and working from my office in Downing St, leading on our response to the pandemic.  https://t.co/jtgLwVCUaU",en,[]
486,borisjohnson,2020-11-21,So proud to be supporting this initiative  #SignUpToStand here:  https://t.co/6EEtdrrGSM    #5050Parliament #AskHerToStand,en,"['signuptostand', '5050parliament', 'askhertostand']"
484,borisjohnson,2020-11-23,"Incredibly exciting news the Oxford vaccine has proved so effective in trials. There are still further safety checks ahead, but these are fantastic results.   Well done to our brilliant scientists at @UniofOxford &amp; @AstraZeneca, and all who volunteered in the trials.",en,[]
