,username,date,tweet,language,hashtags
1121,borisjohnson,2020-01-02,This is going to be a fantastic year for Britain.  https://t.co/dLQUVauCKg,en,[]
1120,borisjohnson,2020-01-06,Our hearts go out to all those in Australia affected by these devastating fires. I have been in touch with PM @ScottMorrisonMP to offer any assistance we can provide. We stand with you at this very difficult time. 🇬🇧🇦🇺,en,[]
1119,borisjohnson,2020-01-08,"Today I met with @vonderleyen. When we leave the EU on January 31st, we will negotiate a new free trade agreement with our European partners and continue to work together as friends and sovereign equals to tackle the world’s greatest challenges.  https://t.co/ahN6gYqIVn",en,[]
1118,borisjohnson,2020-01-10,This is a great step forwards for the people of Northern Ireland and for restoring public confidence in stable devolved Government and delivering much needed reforms to public services.,en,[]
1116,borisjohnson,2020-01-13,"There's a fantastic future for Northern Ireland as part of the United Kingdom, and we're here to support them.  https://t.co/9JkdyplwW3",en,[]
1117,borisjohnson,2020-01-13,RIP Sir Roger Scruton. We have lost the greatest modern conservative thinker - who not only had the guts to say what he thought but said it beautifully.,en,[]
1115,borisjohnson,2020-01-13,"Northern Ireland politicians have put aside their differences, stepped up to the plate and shown leadership.  https://t.co/CLpbqAZV7a",en,[]
1114,borisjohnson,2020-01-14,"Today I have written to Nicola Sturgeon. The Scottish people voted decisively to keep our United Kingdom together, a result which both the Scottish and UK Governments committed to respect.   Let's make 2020 a year of growth and opportunity for the whole of the UK 🇬🇧  https://t.co/JjQp3X2J2n",en,[]
1113,borisjohnson,2020-01-14,We will leave the EU on January 31st and build a great new partnership with our European friends.   Britain has a bright future ahead.  https://t.co/T4vggJi1l8,en,[]
1112,borisjohnson,2020-01-15,Today is the first step towards putting our record NHS funding commitment into law.  https://t.co/IXyhtub9SY,en,[]
1111,borisjohnson,2020-01-20,Today I hosted leaders and entrepreneurs at the UK-Africa Investment Summit in London #InvestInAfrica  https://t.co/pux2EokmB6,en,['investinafrica']
1110,borisjohnson,2020-01-22,🎙 Get ready for another #PeoplesPMQs at 5pm today!  💬 Send me your questions here:  https://t.co/4gBIkrPJHh  https://t.co/1KpndoISUV,en,['peoplespmqs']
1109,borisjohnson,2020-01-22,LIVE: I'm answering your questions from Downing Street  https://t.co/WoBwpJgjiV,en,[]
1108,borisjohnson,2020-01-22,Thank you for your questions. See you again next week #PeoplesPMQs  https://t.co/wc1uZhkaTg,en,['peoplespmqs']
1107,borisjohnson,2020-01-23,"We’re recruiting 20,000 more police and giving them the powers they need to tackle crime. #PeoplesPMQs  https://t.co/EgPqR0wtup",en,['peoplespmqs']
1106,borisjohnson,2020-01-23,The Withdrawal Agreement has received Royal Assent and is now law. We will leave the EU on January 31st 🇬🇧,en,[]
1105,borisjohnson,2020-01-24,"Today I have signed the Withdrawal Agreement for the UK to leave the EU on January 31st, honouring the democratic mandate of the British people.    This signature heralds a new chapter in our nation’s history.  https://t.co/IaGTeeL2is",en,[]
1104,borisjohnson,2020-01-24,"Seamus Mallon made an extraordinary contribution to democracy and peace in Northern Ireland. I want to express my sincere condolences to his daughter Orla, to his family and friends and to the SDLP.",en,[]
1103,borisjohnson,2020-01-26,"This Australia Day, I want all our Aussie friends to know that we Brits are thinking of you. Your resilience &amp; positive spirit has been an inspiration to us all.    Our two nations share a very special friendship that I hope will continue to strengthen. Happy Australia Day.",en,[]
1102,borisjohnson,2020-01-27,"I was truly honoured to meet Mala Tribich MBE and hear her story of surviving the horrors of the Holocaust.   We should all listen to her message, remember and commit ourselves to ensuring that this never happens again.  #HolocaustMemorialDay #WeRemember  https://t.co/wGdmJZR42J",en,"['holocaustmemorialday', 'weremember']"
1101,borisjohnson,2020-01-27,"As long as I am Prime Minister, I will never allow this country to forget what happened 75 years ago. I will do all I can to see that we continue to learn the lessons of the past.   #HolocaustRemembranceDay    https://t.co/wp7t49CPfr",en,['holocaustremembranceday']
1098,borisjohnson,2020-01-28,"🎙 Get ready for another #PeoplesPMQs, 5pm tomorrow night!  💬 Send me your questions here:   https://t.co/wr6740CPjj  https://t.co/orxegNtTyB",en,['peoplespmqs']
1097,borisjohnson,2020-01-28,“Will Brexit affect my holiday?”   I’ve answered some of your top searched questions about Brexit and what happens when we leave the EU on Friday.  https://t.co/3LelRgfFPb,en,[]
1100,borisjohnson,2020-01-28,"Fantastic to visit @kingsmathschool yesterday and meet with these bright students and their teachers.   We’re making an extra £300 million available for research into advanced mathematics, and will introduce a new fast track visa system to welcome more scientists to the UK.  https://t.co/uLF6dRmwlQ",en,[]
1099,borisjohnson,2020-01-28,"I’m delighted to hear @Sainsburys is leading the way for UK business by pledging to go carbon neutral, backed by significant investment. We must all work together to achieve Net Zero emissions.",en,[]
1096,borisjohnson,2020-01-29,I’m answering your questions live from Downing Street  https://t.co/Cu20XxEkaL,en,[]
1095,borisjohnson,2020-01-29,Thank you for your questions this evening for the #PeoplesPMQs.   Tune in for my address this Friday at 10pm.  https://t.co/FHyNQJ4AUN,en,['peoplespmqs']
1094,borisjohnson,2020-01-29,What I will be doing when we leave the EU at 11pm this Friday. #PeoplesPMQs  https://t.co/KrQ4C2f6Oe,en,['peoplespmqs']
1093,borisjohnson,2020-01-29,Youth knife crime is a massive issue for this country. We need to tackle it. #PeoplesPMQs  https://t.co/R6JYU0OIcw,en,['peoplespmqs']
1092,borisjohnson,2020-01-30,We're going to tackle homelessness by addressing its root causes. #PeoplesPMQS  https://t.co/2UpzVlSBfh,en,['peoplespmqs']
1091,borisjohnson,2020-01-30,"Today I invited children from across our country to Downing Street to ask me their questions about the future of the UK.   We spoke about climate change, the NHS, education, science, tech and much more.  https://t.co/R7UFhmYB4Q",en,[]
1088,borisjohnson,2020-01-31,Tonight we are leaving the European Union.  https://t.co/zZBsrf4BLe,en,[]
1089,borisjohnson,2020-01-31,"This government will unite and level up our country.  And as we build a new relationship with the EU, I urge everyone to find closure and let the healing begin.  https://t.co/DnEdK4uiKY",en,[]
1090,borisjohnson,2020-01-31,"Tonight at 10pm I’ll be giving an address to the nation, which you can watch on my Facebook page:  https://t.co/ido2hy9GGX",en,[]
1087,borisjohnson,2020-02-01,Tonight we have left the EU - an extraordinary turning point in the life of this country. Let us come together now to make the most of all the opportunities Brexit will bring - and let’s unleash the potential of the whole UK. 🇬🇧,en,[]
1086,borisjohnson,2020-02-01,"As we embark on a new chapter, let's come together and build a brighter future for the next generation.  https://t.co/0VHVPfv5sp",en,[]
1085,borisjohnson,2020-02-01,"Thank you to @SteveBarclay, @LordCallanan, @JamesDuddridge and to everyone at DExEU for all of your hard work and dedication in getting Brexit delivered.",en,[]
1084,borisjohnson,2020-02-02,"Thank you to all emergency services responding to the incident in Streatham, which the police have now declared as terrorism-related. My thoughts are with the injured and all those affected.",en,[]
1083,borisjohnson,2020-02-03,"We are re-emerging, after decades of hibernation, as a campaigner for global free trade 🇬🇧🌏  https://t.co/zos7YKVCvd",en,[]
1080,borisjohnson,2020-02-04,"Let’s make this year the moment when we come together with the courage and the technological ambition to solve man-made climate change and to choose a cleaner, greener future for all our children and grandchildren.  https://t.co/wuFS5z2cFY",en,[]
1081,borisjohnson,2020-02-04,🎙 I’m hosting another #PeoplesPMQs tomorrow night at 5pm.    💬 Send me your questions here:  https://t.co/f85fLz0f4z  https://t.co/NpVYMUHom7,en,['peoplespmqs']
1082,borisjohnson,2020-02-04,"Delighted to launch the UN Climate Summit  @COP26 with Sir David Attenborough at the  @sciencemuseum this morning.   There is no greater responsibility than protecting our planet, and no mission that a Global Britain is prouder to serve.  https://t.co/iBgkYuTetm",en,[]
1079,borisjohnson,2020-02-05,WATCH LIVE: I answer your questions #PeoplesPMQs #PPMQs  https://t.co/r836l07xpy,en,"['peoplespmqs', 'ppmqs']"
1077,borisjohnson,2020-02-06,We are shortly bringing forward legislation to end the automatic early release of terrorist offenders. #PeoplesPMQs  https://t.co/KMOttaHiP0,en,['peoplespmqs']
1076,borisjohnson,2020-02-06,We’re increasing our support for military veterans.    https://t.co/n9LYBGjDry,en,[]
1078,borisjohnson,2020-02-06,We're transforming mental health services for children and young people – putting in the money and resources so every child can get the support they need.   #ChildrensMentalHealthWeek  https://t.co/sVHXhqlbOe,en,['childrensmentalhealthweek']
1075,borisjohnson,2020-02-07,.@KarenPierceUN is an outstanding and accomplished diplomat and I can think of no better person to drive forward our hugely important relationship with the United States at this time. I’m delighted she’ll be representing us in Washington.,en,[]
1074,borisjohnson,2020-02-11,"HS2 is going to be a truly fantastic opportunity for Birmingham, the Midlands and for the whole country.  https://t.co/g4J47XEtXw",en,[]
1073,borisjohnson,2020-02-11,"Fantastic to visit HS2’s Birmingham Curzon Street site this afternoon.   This project will deliver better, faster and more reliable transport connections across the country.  https://t.co/5T53bNMXoT",en,[]
1072,borisjohnson,2020-02-12,"We’re going to unite and level up across the country with better rail, less congested roads and beautiful British-build buses - making travel cleaner, greener, quicker, safer and more frequent.     https://t.co/ombj6Bb0s9",en,[]
1071,borisjohnson,2020-02-14,"This government will deliver on the priorities of the British people.   Investing more in our NHS and schools, levelling up with better infrastructure, and tackling crime with 20,000 more police on the streets.  https://t.co/vMz7O9cXtO",en,[]
1070,borisjohnson,2020-02-14,"We’re here to deliver for the people of this country.   We're going to cut crime, we're going to tackle homelessness, and we’re going to invest more in our NHS and schools.  https://t.co/DSuQLBPQRZ",en,[]
1069,borisjohnson,2020-02-18,This morning I spoke to Chinese President Xi to express my sympathy and support for those affected by the coronavirus outbreak. The UK government has donated vital medical equipment to the region and we will continue to offer our assistance. (1/2),en,[]
1068,borisjohnson,2020-02-18,"We also agreed on the need to work together to tackle climate change, and resolved to strengthen our economic partnership. (2/2)",en,[]
1067,borisjohnson,2020-02-19,"Next year, we will implement a points-based immigration system - welcoming the best and brightest from around the world whilst maintaining full control of our borders.     https://t.co/XFbjECICbD",en,[]
1066,borisjohnson,2020-02-20,My thoughts are with the people of Germany as they grieve those lost in the terrible attack in Hanau last night.   The UK stands with our German friends against this racist assault on our values.,en,[]
1065,borisjohnson,2020-02-20,"I'm deeply saddened to hear of the attack at the London Central Mosque. It's so awful that this should happen, especially in a place of worship. My thoughts are with the victim and all those affected.",en,[]
1064,borisjohnson,2020-02-24,I was delighted to welcome the young winners of the 'Your NHS' art competition to Downing Street today.   Their creative designs and visions for our NHS were spectacular.  https://t.co/l5G5p4slUa,en,[]
1063,borisjohnson,2020-02-27,"We want to end rough sleeping, help get people off the streets and provide them with the support and encouragement that they need.  https://t.co/WMfg72hEa1",en,[]
1062,borisjohnson,2020-02-28,A huge win in Hillingdon East by-election - thanks to the @Hillingdon_Tory team for their hard work during the campaign.   Colleen has already proven she’s a strong voice for local residents in Hillingdon and I know she’ll be a great addition to the fantastic team of councillors!,en,[]
1061,borisjohnson,2020-03-01,"Coronavirus may very well be a challenge in the weeks and months ahead.  But I have no doubt that with the help of the NHS and its ­incomparable staff, this country will get through it — and beat it.   https://t.co/r7LvqR9MuH",en,[]
1060,borisjohnson,2020-03-02,An update on coronavirus following COBR.  https://t.co/k34Q4XL4MF,en,[]
1059,borisjohnson,2020-03-04,"Today, two years on from the chemical attack in Salisbury, my thoughts remain with all those impacted. It is heartening to see the historic city welcoming visitors and looking to the future, thanks to the strength and character of the community.",en,[]
1058,borisjohnson,2020-03-07,Fantastic afternoon at Twickenham watching the rugby and congratulating the Red Roses on their recent victory.   Congratulations @EnglandRugby and well played @WelshRugbyUnion!  https://t.co/0wilNJXqJD,en,[]
1057,borisjohnson,2020-03-08,Today I visited Worcestershire to see the recovery efforts and pay tribute to the emergency services following flooding.  https://t.co/pF4iQXBSmP,en,[]
1056,borisjohnson,2020-03-09,"It is absolutely critical in managing the spread of this virus that we take the right decisions at the right time, based on the latest and best evidence.  https://t.co/8BbEeJ4dTb",en,[]
1055,borisjohnson,2020-03-11,"Dr Jenny Harries, Deputy Chief Medical Officer, came into Downing Street to answer some of the most commonly asked questions on coronavirus.  https://t.co/jByRhFFfat",en,[]
1054,borisjohnson,2020-03-11,"If you are unwell and think you might have coronavirus, stay at home and either call 111 or use the online service:  https://t.co/xDm8Sg8LnS",en,[]
1053,borisjohnson,2020-03-12,It is with deep sadness that I learned that a UK soldier was killed in the attack at the Taji military base last night. My thoughts go out to their loved ones at this extremely difficult time.,en,[]
1052,borisjohnson,2020-03-12,"The UK’s Chief Medical Officer on the government’s updated advice on #COVID19   If you have: a new continuous cough OR a high temperature (37.8 degrees or higher), you should stay at home for seven days.  Read the full guidance now:  https://t.co/hmhS6y5caq  https://t.co/BbSg7CbEmY",en,['covid19']
1051,borisjohnson,2020-03-13,"This country will get through this epidemic, just as it has got through many tougher experiences before.  https://t.co/3KfFGyRWzA",en,[]
1050,borisjohnson,2020-03-13,"If you have symptoms of coronavirus, it’s important that you stay at home for seven days to help protect your friends and neighbours.  More info:  https://t.co/47UIka9nis  https://t.co/lJyAoDgmcv",en,[]
1049,borisjohnson,2020-03-14,"If you have: a new continuous cough OR a high temperature (37.8 degrees or higher), you should stay at home for 7 days.   Read more here on how best to protect yourself and others whilst staying at home:  https://t.co/P5Ch222CYT  https://t.co/LsLU9wWqBL",en,[]
1048,borisjohnson,2020-03-15,Latest NHS advice:  If you have: a new continuous cough OR a high temperature  You should stay at home for seven days.  Read the full guidance now:  https://t.co/hmhS6y5caq  https://t.co/v8oNM0UU2I,en,[]
1047,borisjohnson,2020-03-16,An update on the latest coronavirus advice.  https://t.co/meymkGzBj3  https://t.co/qPAYFEpdCK,en,[]
1045,borisjohnson,2020-03-17,Today the government has updated its travel guidance with immediate effect.   We are now advising against all non-essential overseas travel.  https://t.co/Zdm45PKyuU,en,[]
1042,borisjohnson,2020-03-17,"I want to say a huge thank you on behalf of the whole country to everyone working in our NHS, for all your hard work at this difficult time.  https://t.co/7hpUFMsfLw",en,[]
1046,borisjohnson,2020-03-17,.@CMO_England Chris Whitty outlines how updated  #coronavirus advice will impact:   ▶️ People aged 70+ ▶️ Adults who would normally be advised to have the flu vaccination ▶️ People with chronic diseases ▶️ Pregnant women   https://t.co/meymkGzBj3  https://t.co/DipjADBvOw,en,['coronavirus']
1044,borisjohnson,2020-03-17,Use these trusted sources of information for the latest advice and guidance on #coronavirus  🩺 Check your symptoms:  https://t.co/uL9bBXzV0F 🏥 Health guidance:  https://t.co/47UIka9nis ℹ All information on coronavirus:  https://t.co/kdHUGOW5he  https://t.co/vwKPJV2CII,en,['coronavirus']
1043,borisjohnson,2020-03-17,“We will do whatever it takes.” – @RishiSunak #coronavirus  https://t.co/rmCLPWvuWr,en,['coronavirus']
1041,borisjohnson,2020-03-18,"However tough the months ahead we have the resolve and the resources to win the fight.  And, to repeat, this government will do whatever it takes.   https://t.co/lg7axA86UB #COVID2019  https://t.co/Kfu8tFvCrM",en,['covid2019']
1040,borisjohnson,2020-03-18,We have the resolve and the resources to win the fight against #Coronavirus  https://t.co/g1SnxlMEzV,en,['coronavirus']
1039,borisjohnson,2020-03-18,"WATCH: a message from @CMO_England on #coronavirus 👇  🏠If anyone in your household has coronavirus symptoms, you must all stay at home  ❌ Do not visit your GP or local hospital  ✅ Visit  https://t.co/hmhS6y5caq to check symptoms and follow the advice  https://t.co/v1zVKCKz8X",en,['coronavirus']
1038,borisjohnson,2020-03-18,"After schools shut their gates from Friday afternoon, they will remain closed for most pupils - for the vast majority of pupils - until further notice.   Read more here:  https://t.co/C5RaaQPGnQ  https://t.co/5jMgPXxDML",en,[]
1037,borisjohnson,2020-03-18,The government has announced that schools will close from Monday  https://t.co/C5RaaQPGnQ  https://t.co/q3I54vQf1V,en,[]
1028,borisjohnson,2020-03-19,"Please be reasonable in your shopping, be considerate and thoughtful of others as you do it.  https://t.co/Dwo7lTIkg7",en,[]
1031,borisjohnson,2020-03-19,"And it’s by this combination of ruthless, determined, collective action, and scientific progress, that we’re already seeing that we will succeed.  If we do this together, we will save many many thousands of lives.  4/5",en,[]
1032,borisjohnson,2020-03-19,"It is absolutely vital that we follow the advice:  Stay at home if you have the symptoms, or if your family has the symptoms.  Avoid unnecessary contact.  Avoid pubs, bars and restaurants.  Work from home, if you possibly can.  And wash your hands.  3/5",en,[]
1029,borisjohnson,2020-03-19,Her Majesty The Queen speaks for us all. We all have a vital role to play. We will do whatever it takes to beat this together.,en,[]
1034,borisjohnson,2020-03-19,"We can send #coronavirus packing in this country, but only if we take the required steps to reduce the peak.  Once we’ve achieved that, then the scientific progress that we are making will really come into play.  1/5",en,['coronavirus']
1033,borisjohnson,2020-03-19,"We’re getting better at testing.  This crisis is so difficult because the enemy is invisible.  The answer is to remove the cloak of invisibility to identify the virus, and to be able to know which of us is carrying it and who has actually had it and got over it.  2/5",en,[]
1036,borisjohnson,2020-03-19,We're going to step up testing for #coronavirus #COVID19  https://t.co/A7cNeBOd1J,en,"['coronavirus', 'covid19']"
1030,borisjohnson,2020-03-19,"I say to business, stand by your employees, stand by your workers, because we will stand by you.  I have absolutely no doubt that we will turn the tide of this disease and beat it together.  5/5",en,[]
1035,borisjohnson,2020-03-19,"I want to say a huge thank you on behalf of the whole country to everyone working in our NHS, of every specialism and role, in our fight against the coronavirus pandemic. We’ve never needed you more than we do today.",en,[]
1027,borisjohnson,2020-03-20,"We can beat this together, but only if we follow government advice and look out for each other.  https://t.co/mavBWIHylf",en,[]
1026,borisjohnson,2020-03-20,NHS staff are doing extraordinary work across the country to help our fight against coronavirus.  We now need to play our part in supporting them by following the government's guidance and working from home if you possibly can.,en,[]
1025,borisjohnson,2020-03-20,"We are telling cafes, pubs, bars and restaurants to close tonight as soon as they reasonably can, and not to open tomorrow.  As far as possible we want you to stay at home.  That’s how we can protect our NHS and save lives.  ➡  https://t.co/kdHUGOW5he  https://t.co/8Hko4bfBnh",en,[]
1024,borisjohnson,2020-03-20,"We are supporting businesses and workers in a way that government has never done before.   If people stay home, then we will not only save thousands of lives, but we will come out of this pandemic all the faster. #StayHomeSaveLives",en,['stayhomesavelives']
1022,borisjohnson,2020-03-20,"To those going against the advice we're getting from our experts, you're not only putting your own life and the lives of your family at risk, you're endangering the community and you're making it more difficult for us to protect the NHS and save lives. #StayHomeSaveLives  https://t.co/WLw17OboHR",en,['stayhomesavelives']
1023,borisjohnson,2020-03-20,"The more we follow the advice, the faster the country will stage both a medical and an economic recovery in full. #StayHomeSaveLives  https://t.co/ik06dvasiH",en,['stayhomesavelives']
1021,borisjohnson,2020-03-21,"We want to protect you. But to do so, we need you to do your bit. #StayHomeSaveLives  https://t.co/oSAzFF5AWk",en,['stayhomesavelives']
1020,borisjohnson,2020-03-21,"The coming months will be challenging, but I want to assure businesses that we are with them every step of the way.  Stand by your employees, stand by your workers, because we will stand by you.  https://t.co/IqTDLOmBve",en,[]
1019,borisjohnson,2020-03-21,Josephine sets a great example to us all by postponing her birthday party until we have sent coronavirus packing.  Together we can beat this. In the meantime let's all wish her happy birthday (twice) whilst washing our hands. #BeLikeJosephine #StayHomeSaveLives  https://t.co/yl7uxe9lhh,en,"['belikejosephine', 'stayhomesavelives']"
1018,borisjohnson,2020-03-21,Our amazing NHS staff want to be there to help you and your loved ones over the coming weeks and months.  You can help them right now by staying inside. #StayHomeSaveLives,en,['stayhomesavelives']
1017,borisjohnson,2020-03-21,Thank you @MariaCaulfield!,en,[]
1012,borisjohnson,2020-03-22,Stay two metres apart.  It's not such a difficult thing.  Do it. It really will save lives.   #coronavirus #StaySafeSaveLives  https://t.co/SSbrwxjEar,en,"['coronavirus', 'staysafesavelives']"
1013,borisjohnson,2020-03-22,We need you to do your bit to help us beat #coronavirus  Please RT.  #StayHomeSaveLives  https://t.co/mSGgGsQDSH,en,"['coronavirus', 'stayhomesavelives']"
1015,borisjohnson,2020-03-22,"This Mother’s Day, everyone should stop #coronavirus spreading.  Keep your mum safe. Stay at home.  #StayHomeSaveLives #MothersDay  https://t.co/6OQ7cGm57w",en,"['coronavirus', 'stayhomesavelives', 'mothersday']"
1014,borisjohnson,2020-03-22,"We will get through this together, and we will beat the virus.   To win this fight, we need everyone to follow our advice: as far as possible, we want you to stay at home. The more effectively everyone does this, the faster this country will recover.  #StayHomeSaveLives",en,['stayhomesavelives']
1016,borisjohnson,2020-03-22,Thank you @AthertonNWales!,en,[]
1011,borisjohnson,2020-03-23,"If you don’t follow these instructions, you are putting people’s lives at risk:   You must stay at home to protect our NHS and save lives.   #StayHomeSaveLives",en,['stayhomesavelives']
1010,borisjohnson,2020-03-23,"These are the people who are saving lives.   Stay at home, protect the NHS, and save lives.    #StayHomeSaveLives",en,['stayhomesavelives']
1009,borisjohnson,2020-03-23,Please join me for an important update on #coronavirus #StayHomeSaveLives  https://t.co/QSlIOIaYsF,en,"['coronavirus', 'stayhomesavelives']"
1008,borisjohnson,2020-03-24,"At this moment of national emergency you must stay at home, protect the NHS and save lives.   #StayHomeSaveLives  https://t.co/nb2baBmMJr",en,['stayhomesavelives']
1007,borisjohnson,2020-03-24,"This morning, I chaired the first ever video conference Cabinet meeting.   We must all do our bit to stop the spread of coronavirus, protect our NHS and save lives. #StayHomeSaveLives    https://t.co/Eew4i0Wr5q  https://t.co/LkWYYnMXnq",en,['stayhomesavelives']
1006,borisjohnson,2020-03-24,"Our athletes are committed to being the best in their field- day in, day out. To see their chance at Olympic glory postponed is hugely disappointing. But they recognise that this means more. We must now show our dedication by staying at home, protecting the NHS and saving lives.",en,[]
